{"patient_name_on_report":"Test Zeta","collection_date":"2026-09-15","reported_date":"2026-09-16","lab_name":"SYNTHETIC LABS INC","results":[{"analyte":"Glucose","value":"105.6","unit":"mg/dL","reference_range":"70-99","abnormal_flag":"H","page":1},{"analyte":"BUN","value":"22","unit":"mg/dL","reference_range":"7-20","abnormal_flag":"H","page":1},{"analyte":"Creatinine","value":"1.2","unit":"mg/dL","reference_range":"0.6-1.2","abnormal_flag":null,"page":1},{"analyte":"Sodium","value":"132.8","unit":"mmol/L","reference_range":"136-145","abnormal_flag":"L","page":1},{"analyte":"Potassium","value":"3.3","unit":"mmol/L","reference_range":"3.5-5.1","abnormal_flag":"L","page":2},{"analyte":"Chloride","value":"97","unit":"mmol/L","reference_range":"98-107","abnormal_flag":"L","page":2},{"analyte":"Calcium","value":"9.3","unit":"mg/dL","reference_range":"8.6-10.3","abnormal_flag":null,"page":2},{"analyte":"Total Cholesterol","value":"157.3","unit":"mg/dL","reference_range":"<200","abnormal_flag":null,"page":2},{"analyte":"LDL Cholesterol","value":"141.6","unit":"mg/dL","reference_range":"<100","abnormal_flag":"H","page":3},{"analyte":"HDL Cholesterol","value":"58.9","unit":"mg/dL","reference_range":">40","abnormal_flag":null,"page":3},{"analyte":"Triglycerides","value":"313.8","unit":"mg/dL","reference_range":"<150","abnormal_flag":"H","page":3},{"analyte":"Hemoglobin A1c","value":"8.8","unit":"%","reference_range":"4.0-5.6","abnormal_flag":"H","page":3},{"analyte":"Hemoglobin","value":"10.6","unit":"g/dL","reference_range":"13.5-17.5","abnormal_flag":"L","page":4},{"analyte":"Hematocrit","value":"36.8","unit":"%","reference_range":"41-53","abnormal_flag":"L","page":4},{"analyte":"WBC","value":"5.4","unit":"10^3/uL","reference_range":"4.5-11.0","abnormal_flag":null,"page":4},{"analyte":"Platelets","value":"311.7","unit":"10^3/uL","reference_range":"150-400","abnormal_flag":null,"page":4},{"analyte":"TSH","value":"4.5","unit":"uIU/mL","reference_range":"0.4-4.0","abnormal_flag":"H","page":5},{"analyte":"ALT","value":"14.8","unit":"U/L","reference_range":"7-56","abnormal_flag":null,"page":5},{"analyte":"AST","value":"51.5","unit":"U/L","reference_range":"10-40","abnormal_flag":"H","page":5},{"analyte":"Vitamin D","value":"27.1","unit":"ng/mL","reference_range":"30-100","abnormal_flag":"L","page":5}]}
