{
  "patient_name_on_report": "Test Zeta",
  "collection_date": "2026-09-15",
  "reported_date": null,
  "lab_name": null,
  "results": [
    {
      "analyte": "Glucose",
      "value": "105.6",
      "unit": null,
      "reference_range": "70-99",
      "abnormal_flag": "H",
      "page": 1
    }
  ]
}
