{"patient_name_on_report":"Test Zeta","collection_date":"09/18/2026","reported_date":"09/19/2026","lab_name":"REGIONAL REFERENCE LABORATORY","results":[{"analyte":"Total Cholesterol","value":"212","unit":"mg/dL","reference_range":"<200","abnormal_flag":"H","page":1},{"analyte":"LDL Cholesterol","value":"100","unit":"mg/dL","reference_range":"<100","abnormal_flag":"H","page":1},{"analyte":"HDL Cholesterol","value":"48","unit":"mg/dL","reference_range":">40","abnormal_flag":null,"page":1},{"analyte":"Triglycerides","value":"160","unit":"mg/dL","reference_range":"<150","abnormal_flag":"H","page":1},{"analyte":"Glucose","value":"92","unit":"mg/dL","reference_range":"70-100","abnormal_flag":null,"page":1},{"analyte":"Creatinine","value":"1.1","unit":"mg/dL","reference_range":"0.6-1.2","abnormal_flag":null,"page":1},{"analyte":"Potassium","value":"4.4","unit":"mmol/L","reference_range":"3.5-5.1","abnormal_flag":null,"page":1}]}
